{
  "schema_version": 1,
  "id": "d65241a-page-072",
  "document_id": "d652-41a",
  "page": 72,
  "section": "S06",
  "type": "blank",
  "titles": {
    "de": null,
    "en-GB": null,
    "es-ES": null
  },
  "source": {
    "image": "source.jpg",
    "pdf_page": 37,
    "side": "left",
    "status": "extracted_clean"
  },
  "paragraphs": [],
  "figures": [],
  "status": {
    "transcription": "validated",
    "en-GB": "validated",
    "es-ES": "validated",
    "figures": "not_applicable"
  },
  "navigation": {
    "previous": "d65241a-page-071",
    "next": "d65241a-page-073"
  }
}
